Wines & Whiskies,Voldersgracht 22,Evolutionaire manipulatie van biergist,"Waarom?
Gebruik maken van evolutionaire druk is een strategie om de prestaties van micro-organismen te verbeteren, want die organismen zijn de werkpaarden van vele industriële processen. 
Het vermogen van biergist om maltotriose, een suiker die veel voorkomt in wort van gerst, om te zetten in alcohol hebben we op die manier aanzienlijk weten te verbeteren.
Hoe?
Er werd gebruikgemaakt van een groeimedium dat was verrijkt met maltotriose om gedurende een groot aantal generaties evolutionaire druk uit te oefenen op een standaardgist.
Tijdens dit survival-of-the-fittest-achtige proces ontwikkelde de gistpopulatie de gewenste verbeterde fermentatievermogens (dankzij natuurlijk voorkomende mutaties).
Wanneer?
De geëvolueerde standaardgist is getest in een bak van 10 hL, en de resultaten kwamen overeen met die in het laboratorium. 
Vanwege de nauwe samenwerking met de industrie kon de technologie met succes worden toegepast op industriële schaal.
",,"Anja Brickwedde MSc
Prof.dr. Jack Pronk 
Dr. Jean-Marc Daran"
Knotten,Voldersgracht 23,Playscapes,"Een steen is niet zomaar een steen; het is een edelsteen. In een holle eik woont een elf, een afgevallen tak is het zwaard van een ridder, en met een emmer bladeren en eikels maak je een ketel heksensoep. 
Het bos is een heerlijke plek om in te spelen. 
Maar wat doe je als je een kind niet naar het bos kunt brengen? Dan breng je het bos naar het kind! 
Dat is de essentie van Stickz, een set van zachte ambigue takvormige objecten ontworpen door promovendus Boudewijn Boon. 
Soms is een ontwerp zo treffend dat je je afvraagt waarom het niet al veel eerder is bedacht. Een ontwerp met een primaire aantrekkingskracht die meteen nieuwsgierig maakt",,"Stickz is ontworpen binnen het onderzoeksproject 'Meedoen=Groeien!’
Dit project is een samenwerking tussen de TU Delft, het Revalidatiefonds en het Prinses Máxima Centrum voor kinderoncologie. 
Voor meer informatie zie: www.meedoenisgroeien.nl "
Lu-st,Voorstraat 8,fly high,"Een drone die op 20 km hoogte moet vliegen – het model is 1.30 lang!
Het maken van dit vliegtuig was voor de Dienst Elektronische en Mechanische Ontwikkeling (bij Lucht- en Ruimtevaart) een mooie uitdaging. 
De samenwerking met opdrachtgever Estec was interessant en leerzaam.  
","A drone designed to fly at a height of 20 kilometres – and the model is only 1.30 metres long!
Developing this craft was an exciting challenge for the Electronic and Mechanical Support Division (at Aerospace Engineering). 
Collaborating with the client Estec proved interesting and instructive.","Faculteit Luchtvaart- en Ruimtevaart 
TUDelft"
Fijn bar & kitchen,Burgwal 11,Stenen uit aardbevingsgebied ,"Bij een aardbeving kan schade ontstaan aan gebouwen. Dat zien we in Groningen, vooral door scheuren in muren. 
Niemand weet nog precies wat gebouwen bij Groningse aardbevingen aankunnen. 
In het Stevinlab van de TU Delft doen we proeven met metselwerk om onder andere de sterkte te bepalen. 
Deze proeven leveren input voor rekenmodellen en computersimulaties. Maar we testen ook “live” op gebouwdelen. 
Door het onderzoek weten we meer over schade en instortingsgevaar bij aardbevingen.
De volgende stap is preventief versterken van bestaande gebouwen om dat soort schades tegen te gaan. ",,Roel Schipper
Ray Brandstore,Wijnhaven 15,Schaalmodel Superbus,"De superbus is een concept van Wubbo Ockels voor een autobus die tussen de 150 en 250 km/uur zou moeten kunnen rijden. 
Een team verbonden aan de TUDelft heeft een prototype ontwikkeld en er zijn testritten gemaakt. 
Een werkend prototype heeft op 17 september 2010 de eerste testritten gemaakt op een terrein van Rijkswaterstaat en werd aan het grote publiek getoond op de transportbeurs in Hannover.
De Superbus is geschikt bevonden om op de weg te rijden. Minister van Infrastructuur en Milieu overhandigde het kenteken op dinsdag 15 mei 2012. 
Aandrijving  :  volledig elektrisch (4 elektromotoren)
Vermogen  :  400 kW (530pk)
Bereik  :  210 km
Kruissnelheid :  250 km/h
Bezetting   :  23 passagiers en 1 bestuurder
Lengte  :  15 meter
Breedte   : 2,50 ",,Science Centre
Drogisterij de Salamander,Markt 47,Exo-L,"De band van EXO-L werkt als een veiligheidsriem voor de enkel die op spanning komt te staan wanneer je dreigt te verzwikken. 
De band van EXO-L wordt niet aangespannen zolang je normale sportbewegingen maakt en dat zorgt voor veel bewegingsvrijheid.
Je krijgt de mogelijkheid om jouw EXO-L Enkelband volgens eigen smaak aan te passen. 
Zo kun je je naam erin laten graveren en zelf bepalen welke kleur perfect bij je outfit past.
Elke EXO-L Enkelband wordt op maat gemaakt met behulp van een 3D-scan en high-end 3D-printtechnologie.
",,www.exo-l.com
ANWB winkel Delft,Pijnepoort 3,Polaire Kleding Antarctica onderzoek ,"Stef Lhermitte onderzoekt aan de TU-Delft dagelijks satellietbeelden van de polen. 
Ook reist hij regelmatig naar Antarctica voor veldonderzoek, in de kleren die je hier ziet. 
In 2017 werd Stef opeens wereldnieuws.  Hij stuitte op een onbekende scheur in de Petermann-gletsjer. O
mdat hij geen expert is op het gebied van deze gletsjer in Groenland, plaatste hij een foto van zijn beelden op Twitter. 
Niet veel later had hij de Washington Post aan de telefoon en kort daarop de NASA. De scheur kan een gevolg zijn van klimaatverandering.",,Stef Lhermitte
Rijwielsporthuis Piet Vonk,Voldersgracht 20,Zandmotor overzichtsmaquette,"De Zandmotor ten Zuiden van Den Haag is een kustbeschermingsproject waaraan TU onderzoekers constant meten. 
De berg zand van 21,5 miljoen m3 die er in 2011 is neergestort, verspreid zich langs de kust. 
We willen weten hoe dat zand zich verspreid en wat er met de omgeving gebeurt. 
Kan de natuur op deze manier zelf aan kustonderhoud doen? De kust wordt in dit pilotproject  breder en veiliger, en er ontstaat ook meer ruimte voor natuur en recreatie.",,Sierd de Vries
Topdeal Watches,Molslaan 26,Miniatuur meettreintje,"Om het spoor te verbeteren heeft de TU Delft een eigen meettrein (CTO - Creatief Treintechnisch Onderzoeksplatform), 
waarmee we innovatieve manieren inzetten om slechte stukken spoorlijn te verbeteren en de levensduur te vergroten. 
Onderzoekers kunnen real-life testen doen en studenten kunnen in het rijdende klaslokaal leren over de uitdagingen van Railbouwkunde.",,prof. Rolf Dollevoet
Halfords,Wijnhaven 17,Eco-runner,"Het Human Power Team heeft als doel om puur op spierkracht de allersnelste te worden. Om dit te bereiken rekruteren en trainen ze atleten, en bouwen ze een hypermoderne fiets, die je hier ziet: de VeloX. Voor de training van de atleten zie je technieken terug die ook in de Olympische teams gebruikt worden. Op technisch vlak is efficiëntie erg belangrijk: om de fiets zit een aerodynamische kap die de luchtweerstand 
verminderd, en onze aandrijflijn maakt een overbrenging van 1 op 18. Dat is 10 keer beter dan op een normale fiets!","The Human Power Team’s objective is to be the fastest on earth while only using muscle power. To reach this goal, they recruit and train athletes and build a high-tech bicycle, the VeloX. 
The athletes are trained using principles you will also see at Olympic teams. On the engineering side of the project, efficiency is the most important. 
An aerodynamic shell covers the bike to reduce air resistance, and our drivetrain has a gear ratio of 1 to 18, which is 10 times better than in a regular bike!",Human Power Team
Van Waay & Soetekouw,Markt 17,Tovertafel,"De Active Cues Tovertafel is een speels product dat ouderen in de midden en late fasen van dementie en mensen met een verstandelijke beperking stimuleert in fysieke en cognitieve activiteit en sociale interactie.
Diverse spellen worden geprojecteerd op tafel, vloer, ligmat en rolstoelblad en reageren op bewegingen. 
De spellen zijn samen met de doelgroepen ontwikkeld middels co-design en sluiten daarom perfect aan bij hun behoeften en mogelijkheden. 
De tovertafelspellen creëren een vrolijke sfeer. Ze zijn zeer geschikt als zelfstandige activiteit, maar zorgen ook voor waardevolle interacties met familie en zorgpersoneel.
",,"Stickz is ontworpen binnen het onderzoeksproject 'Meedoen=Groeien!’
Dit project is een samenwerking tussen de TU Delft, het Revalidatiefonds 
en het Prinses Máxima Centrum voor kinderoncologie. 
Voor meer informatie zie: www.meedoenisgroeien.nl "
Something Extra,Oude Langendijk 36,3D geprinte microscoop van Anthonie van Leeuwenhoek,Deze uitvergrote 3D geprinte microscoop is naar voorbeeld van een originele microscoop gemaakt.,,Science Centre
Miss Morrison,Voorstraat 7,Regenmeter TAHMO,"Het project Tahmo (Trans-African hydro-meteorological observatory) gaat de klimaat -datakloof dichten. Het doel van Tahmo is om 20.000 weerstations te installeren in Afrika.
De weerstations halen hun energie uit een piepklein zonnepaneel en rapporteren met een gsm-telefoon elke vijf minuten hun gegevens over regen, zon, temperatuur, luchtdruk, wind en nog veel meer. Pas met dit soort informatie kan de landbouw ter plaatse optimaal inspelen op een sterk stijgende voedselbehoefte.",,Prof. Nick van de Giesen
Chocolaterie Leonidas,Choorstraat 18,Biosynthese van fosfolipiden zonder cellen,"Waarom?
Lipiden zijn interessant voor zowel wetenschap als industrie (denk bijvoorbeeld aan cosmetica, de toediening van medicijnen en emulgatoren). Het produceren van lipiden in vitro in plaats van in levende organismen (in vivo) biedt een veelzijdig platform voor de synthese van lipiden. Bij dit onderzoek wordt een minimalistische cel gemaakt die in staat is om lipide te produceren en om te groeien en zich te delen.
Hoe?
Er wordt gebruikgemaakt van celvrije genexpressie voor de synthese – in blaasjes op micrometerschaal – van de proteïnemachinerie die nodig is om met eenvoudige uitgangsstoffen aanzienlijke hoeveelheden fosfolipiden te produceren.
Wanneer?
Het prototype van de machinerie voor de synthese van fosfolipiden produceert al een matige hoeveelheid lipiden. Op dit moment proberen we die opbrengst te vergroten door verschillende uitgangsstoffen te gebruiken en door het moleculaire transport door het membraan van de blaasjes te verbeteren.
",,"Duco Blanken MSc 
Dr. Christophe Danelon"
,,,,,,
,,,,,,
