Naam deelnemende onderneming,straat en huisnummer,objectbeschrijving,Kolom2,Kolom22,Kolom3
A.J. Prins,Choorstraat 4,RFID met ontvanger verbonden door LED stip,"Waarom?
Volledig batterij- en draadloos gebruik van CRFID's (tags voor Computationele RadioFrequentie-Identificatie) is nog niet mogelijk,
want voor het programmeren van CRFID’s is een kabel nodig en het is moeilijk om gegevens van een scanner naar CRFID’s te sturen.
Hoe?
Przemysław ontwikkelde het Wisent-communicatieprotocol dat bovenop het commerciële UHF RFID-communicatieprotocol functioneert. 
Dit protocol stelt de RFID-scanner in staat om de CRFID te (her)programmeren, ook wanneer deze al is geplaatst/geïntegreerd.
Wanneer?
Toekomstige CRFID's zullen in staat zijn om met elkaar te communiceren en zo een netwerk te vormen. 
Daardoor worden ze functioneler en kunnen ze op grotere schaal worden gebruikt en zal er nog meer behoefte komen aan protocollen als Wisent.
",,"Dr. Przemyslaw
Jethro Tan Msc
Henko Aantjes
Amjad Majid Msc"
Boederij zuivel en meer,Oude Kerkstraat 3,,"Zelfherstellend asfalt
Waarom?
Veroudering van asfaltwegen kan worden tegengegaan met een verjongingsmiddel. Maar als dit middel wordt aangebracht als een spray, heeft dit alleen effect op de toplaag. Daarom is gekozen voor verjongingscapsules in het asfalt die het asfalt verjongen wanneer dat nodig is.
Hoe?
De capsules die het verjongingsmiddel bevatten meten 1,8 mm en zijn gemaakt van een goedkoop en makkelijk te verwerken alginaat. Wanneer er bij een capsule een microscheur ontstaat, breekt de capsule en lekt het verjongingsmiddel eruit, waardoor het asfalt wordt gevuld en gerepareerd.
Wanneer?
De capsules zijn inmiddels bestand tegen het volledige productieproces van een asfaltweg en in het laboratorium is aangetoond dat ze goed werken. Op dit moment wordt onderzocht hoe de capsules het best kunnen worden ingebracht.
","Self-healing asphalt
Why?
Aging of asphalt roads can be countered by applying a rejuvenator. While a spray of asphalt rejuvenator only penetrates the top layer, these rejuvenator capsules in the asphalt concrete can rejuvenate the asphalt where and when necessary.
How?
The 1,8 mm capsules are made of a cheap and easy to process alginate, containing the rejuvenator in their matrix. When a micro crack occurs across the capsule, the matrix breaks and the rejuvenator leaks out, filling and repairing the asphalt.
When?
The capsules are already able to withstand the entire production process of an asphalt road, and their result has been proven on lab scale. The details of the application method are being investigated.
","Shi Xu MSc  
Prof.dr.ir. Erik Schlangen"
Galerie XS,Voorstraat 16,Opengemaakt harde schijf van een laptop,"Een harde schijf, van het Engelse hard disk drive of HDD, is een vorm van extern geheugen, een elektromechanisch computeronderdeel  waarop gegevens bewaard kunnen worden. 
Met de aanduiding harde schijf kan men de eigenlijke schijf bedoelen waarop in de vorm van magnetische polarisatie de gegevens zijn geschreven, 
maar meestal bedoelt men het hele apparaat met schijven, lees- en schrijfkoppen en besturingselektronica, samen in een behuizing.
In IT-documentatie wordt de term vaste schijf gebruikt, omdat de schijf vast in de computer gemonteerd wordt. De gegevens zijn permanent, 
in tegenstelling tot het vluchtige random-acces memory (RAM), en blijven ook bewaard als de computer uit staat. 
Een harde schijf is tegenwoordig altijd voorzien van een besturingseenheid, de controller. Dit is een elektronische schakeling die de toegang tot de data op de schijf regelt. (bron: wikipedia)",,"Studieverzameling
Faculteit Ewi/TUDelft"
Stads-Koffyhuis,Oude Delft 133,Ronddraaiende windturbine met verschillende geluidsfragmenten,"Waarom?
Het geluid dat de wind over de bladen van windturbines maken is hinderlijk. 
Daardoor kunnen ze niet op elke plek worden geplaatst en is de energieproductie beperkt, en dat zorgt weer voor hogere kosten van de opgewekte energie.
Een geluidsreductie van 1dB maakt een vergroting van de energieproductie mogelijk met 2 tot 4%.
Hoe?
Hard schuim uit de 3D-printer wordt aangebracht op de achterrand van de bladen, en dat fungeert als een effectief geluidsdempingssysteem dat de 
hydrodynamische stroming en de akoestische verstrooiing verandert en de drukfluctuaties op het oppervlak dempt. 
Wanneer?
Het huidige onderzoek is gericht op de invloed van de vorm, grootte, en verspreiding van de poriën op de hydrodynamische/akoestische efficiëntie en
de invloed van omgevingsfactoren (bijvoorbeeld: stof) op de akoestische prestaties op de lange termijn. 
Over 4 jaar moet er een volledig ‘proof of concept’ zijn (een werkend prototype).
",,"Dr. Francesco Avallone
Dr. Daniele Ragni
Alejandro Rubio Carpio Msc
Dr. Mirjam Snellen"
Koffie & Zo Delft,Peperstraat 17,Simplex Spiegelgalvanometer,"Frabrikaat:   Nederlandsche Optiek- en Instrumentenfabriek Dr. C.A. Bleeker
Jaartal:   ca 1950
Doel:   Het meten van hééél kleine stroompjes
Wat zit erin?
1. Een dunne draad met spoeltje, waarop een heel klein spiegeltje is geplakt 
2. Een sterke magneet
Hoe werkt het? Als er een klein stroompje door het spoeltje gaat, draait het spoeltje en dus ook het spiegeltje
Hoe zie je dat? Via een prisma stuur je een lichtstraal naar het spiegeltje
Het weerkaatste licht gaat naar het projectiescherm en geeft daar een lichtvlek
En dan? Als het spiegeltje draait (door het stroompje) verschuift de lichtvlek
Dus? … kun je zien dat er een (heel klein) stroompje loopt. Slim, hè?
Leuk om te weten: Met zo’n ding maakte Willem Einthoven in 1903 het allereerste Electrocardiogram (“hartfilmpje”) 
",,"Studieverzameling 
Faculteit EWI/TUDelft"
Van Loenen Horlogerie Stadsuurwerkmaker,Markt 63,chirurgische schaar,"De steerable punch is een chirurgisch instrument om beschadigde delen (scheuren) van de meniscus in de knie weg te knippen. 
Dit gebeurt doormiddel van een laparoscopische operatie (kijkgat). 
De tip van de punch is stuurbaar waardoor ook de moeilijk te bereiken plekken van de meniscus bereikt kunnen worden. 
Een tweede speerpunt van de punch is dat de tip gedemonteerd kan worden voor betere schoonmaak.",,"Audry Zoncsich, MSc"
Milo Design Gifts,Markt 83,Ampere meter,"Fabricaat:  Hartman & Brown (Duitsland)
Jaartal: ca 1945
Doel:  Het meten van heel kleine stromen.

Wat zit erin?
1. Een sterke magneet
2. Een spoeltje van dun draad 
3. Een wijzer, die aan het spoeltje vast zit
Hoe werkt het?
Als er een klein stroompje door het spoeltje gaat, draait het spoeltje en dus ook de wijzer
Wat kun je er mee?
Je kunt er heel kleine stroompjes mee meten. Omdat de wijzer in het midden staat, kun je positieve en negatieve stroom meten.
Waar gebruik je hem voor?
Het vergelijken van een onbekende spanning met een bekende spanning.
",,"Studieverzameling 
Faculteit EWI/TUDelft"
No 13,Oude Langendijk 13,Exoskelet,"Deze mindwalker is een exoskelet (uitwendig skelet) dat eveneens bestaat uit motoren en
een stalen constructie. Het exoskelet zorgt ervoor dat mensen die vanaf hun middel verlamd zijn gewoon kunnen lopen en dus niet per definitie voortaan aan een rolstoel gekluisterd zijn.
Op vier voeten zou het vrij simpel zijn, maar overeind blijven op twee benen is niet eenvoudig. Lopen is verder ook een samenspel tussen denken en doen. 
Er moet sprake zijn van maximale samenwerking tussen mens en machine.

","The Mindwalker consists of an exoskeleton (external frame) incorporating motors and a steel structure. 
This should enable people paralysed from the waist down to walk again, so that they no longer have to rely upon wheelchairs.
With four legs this would be fairly simple to achieve, but keeping the Mindwalker and its wearer upright on two is not easy. 
And walking is an even greater challenge; there has to be full co-operation between man and machine.
",Project March
Bloemig,Peperstraat 38,plaat met bak met planten en print-ding,"Waarom?
Ons nieuwe productieproces voor het printen van flexibele elektronica maakt het mogelijk om hoogwaardig en chemisch stabiele kristallijn silicium te printen op flexibele, 
biologisch compatibele of afbreekbare substraten als papier.
Hoe?
Bij het nieuwe proces wordt gebruikgemaakt van een nieuwe ‘siliconeninkt’ die met uv-licht kan worden uitgehard en niet hoeft te worden verhit tot zeer hoge temperaturen, 
zoals bij traditionele processen het geval is. Omdat kristallijn silicium kan worden gebruikt, zijn slecht presterende en vaak giftige organische inkten niet meer nodig.
Wanneer?
Het proces is inmiddels ontwikkeld, geoptimaliseerd en gepatenteerd. Er zijn basale circuitcomponenten vervaardigd die veel betere prestaties leveren en chemisch stabieler zijn. 
De volgende stap is de ontwikkeling van een compleet sensorsysteem.
",,"Dr. Ryoichi Ishihara
Yuanxing Xu MSc 
Dr. Miki Trifunovic"
Meijer & Meijer,Markt 13,Diatomen als bouwstenen voor nieuwe materialen,"Waarom?
Diatomen zijn microscopisch kleine exoskeletten van silica met verschillende poreuze structuren op nanometer-/micrometerschaal die 
kunnen worden gebruikt als duurzame en kosteneffectieve dragers voor de gecontroleerde afgifte van actieve substanties.
Hoe?
Het vermogen van de exoskeletten om substanties op te slaan en vervolgens af te geven kan bijvoorbeeld worden gebruikt voor 
zelfherstellende antiroestcoatings, bouwmaterialen, de voedingsmiddelenindustrie en de gecontroleerde interne toediening van medicijnen.
Wanneer?
De volgende stap van het onderzoek is het bepalen van de invloed van de soortafhankelijke diatoomstructuur op de dynamica van de afgifte 
en hoe de structuur en de oppervlakte van de exoskeletten kunnen worden aangepast om deze dynamica te beïnvloeden.
",,"Dr. Santiago Garcia 
Ir. Paul Denissen"
Van Maanen Delft,Hippolytusbuurt 3,Feedback in real time over individueel gebruik van faciliteiten,"Waarom?
Slimme apparaten kunnen worden gebruikt voor het binnen en buiten volgen van mensen. 
Door gegevens van verschillende locaties te combineren met andere datasets kan feedback over het gebruik van faciliteiten worden verkregen waarmee het beheer van die faciliteiten kan worden verbeterd, 
en dat komt ook de gebruikerservaring ten goede.
Hoe?
Dit onderzoek is gericht op netwerkgebaseerde methoden (met wifi, bluetooth, enzovoort) voor het lokaliseren van mensen. Er wordt onderzoek gedaan naar toepassingen voor deze technologie en naar manieren om analyse in real time van verwerkte gegevens mogelijk te maken.
Wanneer?
De campus van de TU Delft is een levend laboratorium geweest voor de technologie. We maakten gebruik van de wifi-verbindingen van studenten en medewerkers voor de bestudering van de bezettingsgraad van de collegezalen, de looproutes over de campus, de wifi-capaciteit en dergelijke. 
",,"Dr. Stefan van der Spek
Ir. Edward Verbree"
Rivendel,Choorstraat 14,3D print stadstructuur & huis opstelling waarin te zien is hoe geothermische energie werkt,"Door: 
Waarom?
Geothermische projecten vereisen grote kapitaalinvesteringen om de natuurlijke hulpbron te kunnen bereiken: heetwaterreservoirs diep onder de grond. Bij het nemen van beheerbeslissingen wordt in hoge mate vertrouwd op het modelleren van de reactieve stroming en het transport door de verschillende soorten rots.
Hoe?
We beschikken over unieke deskundigheid op het gebied van modellering en evaluatie van onzekerheden ten aanzien van heetwaterreservoirs. Bij geothermische energie kunnen we daardoor betere voorspellingen doen, de projectprestaties beter beheersen en de financiële risico's, de milieurisico's en de veiligheidsrisico's beter inschatten.
Wanneer?
Onze methode wordt toegepast bij het DAP (Delft Geothermal Project). Het doel is het leveren van energie aan het centrale verwarmingssysteem van de TU Delft en het verkrijgen van wetenschappelijke gegevens voor monitor- en onderzoeksdoeleinden.
","
","Denis Voskov 
Mark Khait MSc 
Prof.dr. David Bruhn"
NOA NOA,Choorstraat 12,"Virtuele omgeving voor gezamenlijk onderzoek
","Waarom?
VRE's (Virtual Research Environments: virtuele onderzoeksomgevingen) zijn noodzakelijk voor een efficiënte samenwerking tussen verschillende wetenschappelijke disciplines bij het oplossen van maatschappelijke problemen. Bij de huidige VRE’s is sprake van tegenstrijdige gegevens, gebrekkige gebruikerservaring en onduidelijkheid over de geldigheid van gegevens in verschillende contexten.
Hoe?
Voor ons nieuwe prototype van een virtuele omgeving voor gezamenlijk onderzoek maken we gebruik van bestaande VRE-tools en gestandaardiseerde bouwstenen en workflows en ontwikkelen we innovatieve nieuwe tools, bouwstenen en workflows als dat nodig is. Dit zorgt voor een VRE die beter te gebruiken, te beheren en te implementeren is.
Wanneer?
De VRE wordt getest voor onderzoek in verschillende wetenschappelijke domeinen, waaronder de milieu- en aardwetenschappen (men denke bijvoorbeeld aan milieuvervuiling, klimaatverandering en aardbevingen), waarbij wordt voortgebouwd op 25 gevallen van echt gebruik.
",,"Dr. Anneke Zuiderwijk-van Eijk 
Yi Yin MSc"
Computers Vandaag,Vrouw Juttenland 5,GPU met 3d geprinte structuren,"Waarom?
Bij driedimensionaal printen zijn robuuste geometrische berekeningen van essentieel belang wanneer in de ontwerpfase en bij het genereren van het printerpad 
sprake is van een complexe geometrie. 
Deze nieuwe modelmaker is sneller, eenvoudiger en robuuster dan de huidige alternatieven.
Hoe?
Bij deze LDNI-gebaseerde methode (LDNI: Layered Depth-Normal Image: gelaagde afbeelding met normale diepte) wordt de geometrie niet expliciet gedefinieerd en berekend,
maar worden objecten gerepresenteerd in de vorm van een verzameling afbeeldingen. 
Met LDNI kunnen handelingen als offsetten en het ontwerpen van ondersteunende elementen bijna in real time worden uitgevoerd, terwijl dat voorheen uren kostte.
Wanneer?
Bij een aantal testcases is aangetoond dat de modelmaker robuust en effectief is. 
De opensource-modelmaker is klaar voor verdere integratie in diverse softwaresystemen voor ontwerp en vervaardiging.
",,"Prof.dr. Charlie Wang
Dr. Jun Wu"
De Winkel,Vrouw Juttenland 39,Een met technische componenten gemaakte robot,Een met technische componenten gemaakte robot,,"Studieverzameling 
Faculteit EWI/TUDelft"
Georg Jensen,Choorstraat 28,Klein muurtje van glazen bakstenen,"Glas breekbaar? Onzin, zo blijkt, want glas is onder druk juist ontzettend sterk. 
In het Stevin II laboratorium van de TU Delft doen promovendi en hoogleraren daarom als een van de weinige groepen ter wereld onderzoek naar glas als constructiemateriaal. 
De uitdaging: sterke en veilige constructies maken en toch de transparantie behouden. 
De Chanel winkel in Amsterdam heeft dankzij glasprofessor Rob Nijsse en z’n team zijn beroemde glazen gevel! 
Opgetrokken van gelijmde glazen bakstenen zoals je hier ziet.",,Prof. Rob Nijsse
De Etalage Fabriek,Oude Kerkstraat 8,ADAM: Acoustics by parametric Design and Additive Manufacturing (akoestiek met parametrisch ontwerp en additieve vervaardiging),"Waarom?
Het effectief neutraliseren van ongewenste lage frequenties is lastig en beperkt de architecturale vrijheid. Met onze nieuwe methode maken we gebruik van passieve geluidsabsorptie. Deze methode biedt een oplossing die eenvoudig is aan te passen aan de omstandigheden.
Hoe?
Buizen die zijn opgenomen in een 3D geprinte structuur , zoals een gebogen paneel of een vrijstaande vorm, maken gebruik van passieve destructieve interferentie om een specifieke frequentieband te neutraliseren. Dat werkt zeer goed bij lagere frequenties (zware machines, vliegtuigen).
Wanneer?
De methode wordt getest bij drie gangbare toepassingen. Bij verdere opschaling is het ontwikkelen van ontwerpsoftware nodig die architecten in staat stelt om de technologie op eenvoudige wijze toe te passen.
","Why?
Cancelling out undesired low frequencies is hard to do effectively and limits architectual freedom. Our novel passive sound absorbing method offers an easily customisable solution.
How?
Tubes integrated in a 3D printed geometry such as a curved panel or freestanding form apply Passive Destructive Interference to cancel out a specific, tuneable, frequency band. It does so especially effective for lower frequency ranges (heavy machinery, airplanes).
When?
The method is being demonstrated in three typical application areas. Further scale up involves developing design software for easy application of the technology by architects.
","Ir. Foteini Setaki MSc
Prof. dr. ir. Arjan van Timmeren
Dr. ir. Martin Tenpierik
Dr. Michela Turrin March 
Dr. ir. Martin Tenpierik"
Xue Mei's arts & crafts,Vrouw Juttenland 21,Stuk zelfherstellend beton,"Bouwen met beton dat zichzelf kan herstellen?
Het lijkt een utopie, maar als het aan microbioloog en uitvinder Henk Jonkers van de TU Delft ligt is dit realiteit.
Hij ontwikkelde het bio-beton van de toekomst, waarbij hij zich liet inspireren door de natuur: beton met bacteriën. 
Deze kalksteen-producerende bacteriën kunnen ruim 200 jaar in beton kunnen overleven en zelf in actie komen als er schade optreedt.
Als er bijvoorbeeld barsten ontstaan door druk op het beton, worden deze vanzelf gedicht.",,Henk Jonkers
Boekhandel de Omslag,Wijnhaven 16,Draadloze e-bike oplader,"Waarom?
Het onderzoek is bedoeld om het gebruiksgemak van elektrische fietsen te vergroten, met name door het opladen van de fietsen eenvoudiger te maken met een draadloze oplaadtegel. 
Op die manier willen we het gebruik van de elektrische fiets bevorderen als alternatief voor de auto.
Hoe?
De tegel genereert een magnetisch veld waarmee de accu van de fiets wordt opgeladen via de aangepaste dubbele standaard. 
De tegel is volledig automatisch, vandalismebestendig en kan onzichtbaar worden geïntegreerd in de stedelijke ruimte.
Wanneer?
De technologie is klaar voor commerciële toepassingen. Het doel is de ontwikkeling van een pakket van minder dan 100 euro dat 
aan elke elektrische fiets kan worden toegevoegd om gebruik van het draadloze oplaadsysteem mogelijk te maken.
",,"Prof.dr. eng Pavol Bauer
Ir. Tim Velzeboer
Dr.ir. Peter van Duijsen
Dr.ing. Bart Roodenburg"
Instore conceptstore,Voldersgracht 18,Mesh Lingerie,"Met Mesh Lingerie wordt iedere vrouw een Muze. Wij maken lingerie op maat gebaseerd op je persoonlijke 3D body scan. 
De traditionele bh beugel wordt vervangen door een 3D geprint ondersteuningselement, gebaseerd op jouw lichaam. 
Overige maten die nodig zijn voor het textiele gedeelte worden ook uit de 3D body scan gehaald om zo de perfecte bh te creëren voor een volgende Mesh Muze. 
Mesh Lingerie is begonnen als afstudeerproject van Lidewij van Twillert. 
Ze zocht een project waarin haar visie naar voren zou komen: ""Ik denk dat een goed product of kledingstuk alleen kan bestaan wanneer vorm en functie één zijn.”
Door techniek te integreren in de wereld van mode, maakt zij met Mesh bh’s die mooi én comfortabel zijn. ","Mesh Lingerie turns every woman into a Muse by making her a custom fit bra based on a personal 3D bodyscan. Traditional underwires are replaced by 3D printed support elements. 
The name Mesh Lingerie finds its origin in the file format of 3D scans. Being 3D scanned by Mesh Lingerie will automatically turn a customer into a Mesh Muse. 
Mesh Lingerie started at Delft University of Technology and was founded by Dutch fashion design engineer Lidewij van Twillert. 
She thinks a good product or garment can only exist when form and function are one: By integrating technology we make bras that shape, support and have aesthetic qualities.",Lidewij van Twillert
O'Donna,Molslaan 12,Berg rode steentjes Rijn experimenten,"Rivieren meanderen van nature: ze maken een slingerende beweging door het landschap heen. In Nederland zie je dat niet zoveel meer.
Rivieren zijn rechter gemaakt  en er is door bedrijven ook veel zand van de rivierbodems afgegraven.  
De bodem is door dit soort ingrepen gezakt.  Gewoon zand en stenen toevoegen? Dat is door de stroming en beweging van het water te eenvoudig.  
We willen niet nog een keer verkeerd ingrijpen… 
Onderzoeker Victor Chavarrias meet wat er allemaal met verschillende formaten felgekleurde steentjes gebeurt, in een neprivier in het waterlab van  de TU Delft.  ",,Victor Chavarrias
M. Edelsmeden & Design,Hippolytusbuurt 2,Ineengrijpende componenten van gegoten glas,"Waarom?
Ineengrijpende glazen bakstenen vormen esthetisch aantrekkelijke bouwcomponenten voor dragende constructies.
Ze zijn sterker dan beton en volledig transparant en kunnen gemakkelijk worden geplaatst en weggenomen (waardoor ze eenvoudig te recyclen zijn).
Hoe?
De ineengrijpende glazen bakstenen worden gestapeld met een droge, kleurloze tussenlaag ter compensatie van de toleranties in de afmetingen als gevolg van de productiemethode. 
Met gegoten glas zijn dikkere, complexere en sterkere componenten te maken dan met het gangbare floatglas.
Wanneer?
Met behulp van onderzoekend ontwerpen wordt de kennisbasis vergroot om het gebruik van glas in dragende elementen mogelijk te maken. 
De verkregen kennis (bijvoorbeeld ontwerpregels, productiemethoden en ontwerpsoftware) wordt gedeeld met zowel mensen uit de praktijk als de wetenschappelijke gemeenschap.
",,"Ir. Faidra Oikonomopoulo
Ir. Tlesilla Brisogianni
Ir. Lida Barou
Dr.ir. Fred Veer"
Steendam,Wijnhaven 20A-21,Raket,"Deze CanSat raket is gebouwd om meerdere CanSat satellieten (gebouwd door middelbare scholieren), naar een hoogte van ongeveer 1 kilometer te lanceren.
Op het hoogste punt worden alle cansats losgelaten, en komen ze met hun eigen parachute naar beneden. Tijdens de hele vlucht kunnen de middelbare scholieren allerlei metingen doen voor hun project. Het filmpje dat u hiernaast ziet geeft een overzicht van andere projecten waar binnen DARE aan wordt gewerkt.",,Dare
"Kookwinkel ""het Pauwtje""",Voldersgracht 5,Context Variation by Design: welbewust ontwerpen voor schaalbaarheid,"Waarom?
Bij CVD (Context Variation by Design: opzettelijke contextvariatie) wordt de complexiteit van de werkelijkheid als uitgangspunt genomen bij het aanpakken van maatschappelijke problemen. Dit maakt het mogelijk om oplossingen te bedenken die makkelijker zijn aan te passen aan verschillende contextuele behoeften.
Hoe?
Bij CVD wordt uitgegaan van vier principes: systematische variatie, hiërarchische ontleding, satisficing (het onderzoeken van de beschikbare mogelijkheden tot één van die mogelijkheden voldoet) en discursiveness . Met behulp van deze principes worden ontwerpruimtes gecreëerd die zijn gebaseerd op collectieve intelligentie en niet slechts op contextspecifieke intelligentie. Er kunnen onverwachte verbanden tussen verschillende contexten mee worden ontdekt en dat kan leiden tot nieuwe oplossingen.
",,"Ir. Wouter Kersten
Prof.dr.ir. Jo van Engelen 
Dr.ir. Jan-Carel Diehl"
De Blauwen Hont ,Voorstraat 16,Schaats,"Otto den Braver bedacht de PeakSkate tijdens zijn studie Werktuigbouwkunde. 
De PeakSkate is een nieuw soort schaats waarmee je nóg sneller kunt rijden. 
Het idee is relatief eenvoudig: bij conventionele schaatsen bezit het glij-ijzer een ronding om te kunnen sturen. 
Hoe vlakker deze ronding, hoe beter het ijzer glijdt. Maar het ijzer glijdt niet alleen beter, het wordt ook minder stuurbaar. 
De PeakSkate is zodanig ontworpen dat het ijzer vlak is, terwijl je er toch goed meer kan sturen. ","Otto den Braver thought up the PeakSkate during his mechanical engineering studies. The PeakSkate is a new kind of ice skate that produces faster times than ever. 
The idea is relatively simple: the blades of conventional skates are curved to facilitate steering. 
The flatter the curve, the better the blades glide. But flatter blades don’t just glide better, they also make it harder for the skater to steer. 
The PeakSkate was developed with a flat blade, but one that leaves the skater in control. ",Otto den Braver
Bonne Vie,Hippolytusbuurt 47,Gesteentes proefboring voor geothermie,"Duurzame energie uit de grond? Dat kan! Water diep in de ondergrond wordt opgewarmd door de aarde en kan gebruikt worden om energie op te wekken.
Maar dan moet het water wel omhoog gepompt worden. 
Om dit verantwoord te kunnen doen is het belangrijk om goed te weten wat de eigenschappen zijn van het gesteente waar het water zich bevind
en hoe het reageert op boren en pompen. Dit onderzoekt Richard Bakker, zodat we in de toekomst verantwoord met aardwarmte onze huizen kunnen verlichten en verwarmen.",,Richard Bakker
Pleck,Voldersgracht 17A,Stapel versnipperd plastic,"Plastic recyclen lijkt een logische stap in de vermindering van  afval, maar is heel lastig.  Er zijn eigenlijk 250 soorten verpakkingsplastic die zich heel slecht laten mengen. 
Professor Peter Rem van de TU Delft werkt hard aan een oplossing. 
Met magnetische vloeistof is het al mogelijk om versnipperd plastic in een aantal soorten te onderscheiden. 
Er wordt ook hard gewerkt aan effectief sorteren op kleur. Slimme techniek wordt de absolute doorbraak in recycling, al moet er nog veel gebeuren!",,prof. Peter Rem
